URL,Title,Title Length,Meta Description,Meta Length,Has Schema,Issues
"https://5starroofingpros.comapp/about/","About 5 Star Commercial Roofing | Amarillo, Midland, Odes...",60,"Over 10 years serving Amarillo, Midland, Odessa and West Texas. Call for a free quote!",86,true,"SHORT_META"
"https://5starroofingpros.comapp/amarillo-homes-roofing-services/","Amarillo Homes Roofing| Expert Residential Services",51,"Amarillo Homes Roofing Services is here to cater to all your roofing needs. We guarantee exceptional results. Free inspections available.",137,true,""
"https://5starroofingpros.comapp/amarillo-texas-roofing/","Amarillo Texas Roofing | Local Hail Experts",43,"Trusted roofing contractor serving Amarillo, Texas. hail damage repair, residential & commercial roofing, metal roofs, and free inspections.",140,true,""
"https://5starroofingpros.comapp/amarillo-weather-impact-on-roofing/","Understanding Climate and Roof Longevity in Amarillo",52,"Explore the impact of Amarillo",30,true,"SHORT_META"
"https://5starroofingpros.comapp/amarillos-best-roofer/","Amarillo",8,"Need a reliable roofing company in Amarillo? Amarillo",53,true,"SHORT_TITLE; SHORT_META"
"https://5starroofingpros.comapp/articles/","Roofing Articles & Local Amarillo Guide | 5 Star Commerci...",60,"Read our roofing articles and explore local Amarillo attractions. Expert tips on hail damage, storm damage, and roofing maintenance for West Texas homes.",153,true,""
"https://5starroofingpros.comapp/asphalt-flat-roof-repair-in-amarillo/","Flat Roof Repair Amarillo TX | BUR & Asphalt",44,"Roof Repair in Amarillo, TX. Free inspections, insurance claim help, fast response. Call 5 Star Roofing for a free quote today!",127,true,""
"https://5starroofingpros.comapp/asphalt-roofing-in-amarillo/","Asphalt Roofing Amarillo TX | 5 Star Roofing",44,"asphalt shingle installation in Amarillo, Midland, Odessa. Class 4 impact-resistant shingles for hail protection. Free inspections available.",141,true,""
"https://5starroofingpros.comapp/asphalt-shingle-roofing-amarillo/","Asphalt Shingles Amarillo TX | 5 Star Roofing",45,"Professional asphalt shingle roofing in Amarillo TX. Expert installation, 24/7 emergency service, insurance assistance. Free inspections. Call (806) 622-6041",157,true,""
"https://5starroofingpros.comapp/asphalt-shingle-roofing-andrews/","Asphalt Shingles Andrews TX | 5 Star Roofing",44,"Quality asphalt shingle roofing in Andrews TX. Permian Basin experiences 6-8 hailstorms annually. Free inspections. Call (806) 622-6041",135,true,""
"https://5starroofingpros.comapp/asphalt-shingle-roofing-big-spring/","Asphalt Shingles Big Spring TX | 5 Star Roofing",47,"Quality asphalt shingle roofing in Big Spring TX. West Texas experiences 7-9 hailstorms annually. Free inspections. Call (806) 622-6041",135,true,""
"https://5starroofingpros.comapp/asphalt-shingle-roofing-borger/","Asphalt Shingles Borger TX | 5 Star Roofing",43,"asphalt shingle roofing in Borger TX. Texas Panhandle experiences 6-8 hailstorms annually. High Plains winds 60+ mph. Free inspections. Call (806) 622-6041",155,true,""
"https://5starroofingpros.comapp/asphalt-shingle-roofing-canyon/","Asphalt Shingles Canyon TX | 5 Star Roofing",43,"asphalt shingle roofing in Canyon TX. Texas Panhandle experiences 6-8 hailstorms annually. High Plains winds 60+ mph. Free inspections. Call (806) 622-6041",155,true,""
"https://5starroofingpros.comapp/asphalt-shingle-roofing-dumas/","Asphalt Shingle Roofing Dumas TX | Class 4 | Free Inspection",60,"asphalt shingle roofing in Dumas TX. Texas Panhandle experiences 6-8 hailstorms annually. High Plains winds 60+ mph. Free inspections. Call (806) 622-6041",154,true,""
"https://5starroofingpros.comapp/asphalt-shingle-roofing-levelland/","Asphalt Shingles Levelland TX | 5 Star Roofing",46,"Quality asphalt shingle roofing in Levelland TX. South Plains experiences 7-10 hailstorms annually. Free inspections. Call (806) 622-6041",137,true,""
"https://5starroofingpros.comapp/asphalt-shingle-roofing-lubbock/","Asphalt Shingles Lubbock TX | 5 Star Roofing",44,"Professional asphalt shingle roofing in Lubbock TX. Expert installation, 24/7 emergency service, insurance assistance. Free inspections. Call (806) 622-6041",156,true,""
"https://5starroofingpros.comapp/asphalt-shingle-roofing-midland/","Asphalt Shingles Midland TX | 5 Star Roofing",44,"Professional asphalt shingle roofing in Midland TX. Expert installation, 24/7 emergency service, insurance assistance. Free inspections. Call (806) 622-6041",156,true,""
"https://5starroofingpros.comapp/asphalt-shingle-roofing-monahans/","Asphalt Shingles Monahans TX | 5 Star Roofing",45,"Quality asphalt shingle roofing in Monahans TX. Permian Basin experiences 6-8 hailstorms annually. Free inspections. Call (806) 622-6041",136,true,""
"https://5starroofingpros.comapp/asphalt-shingle-roofing-odessa/","Asphalt Shingles Odessa TX | 5 Star Roofing",43,"Professional asphalt shingle roofing in Odessa TX. Expert installation, 24/7 emergency service, insurance assistance. Free inspections. Call (806) 622-6041",155,true,""
"https://5starroofingpros.comapp/asphalt-shingle-roofing-pampa/","Asphalt Shingle Roofing Pampa TX | Class 4 | Free Inspection",60,"asphalt shingle roofing in Pampa TX. Texas Panhandle experiences 6-8 hailstorms annually. High Plains winds 60+ mph. Free inspections. Call (806) 622-6041",154,true,""
"https://5starroofingpros.comapp/asphalt-shingle-roofing-perryton/","Asphalt Shingles Perryton TX | 5 Star Roofing",45,"asphalt shingle roofing in Perryton TX. Texas Panhandle experiences 6-8 hailstorms annually. High Plains winds 60+ mph. Free inspections. Call (806) 622-6041",157,true,""
"https://5starroofingpros.comapp/asphalt-shingle-roofing-snyder/","Asphalt Shingles Snyder TX | 5 Star Roofing",43,"Quality asphalt shingle roofing in Snyder TX. West Texas experiences 7-9 hailstorms annually. Free inspections. Call (806) 622-6041",131,true,""
"https://5starroofingpros.comapp/blog/best-roofing-materials-texas-2025/","Best Roofing Materials for Texas Climate 2025 | Expert Guide",60,"Complete guide to the best roofing materials for Texas. Compare asphalt shingles, metal roofing, tile, and more for heat, hail, and wind resistance.",148,true,""
"https://5starroofingpros.comapp/blog/how-to-file-hail-damage-insurance-claim/","How to File a Hail Damage Insurance Claim | Step-by-Step ...",60,"Complete guide to filing hail damage insurance claims in Texas. Step-by-step process, what insurance covers, common mistakes to avoid.",134,true,""
"https://5starroofingpros.comapp/blog/","Roofing Blog & Resources | 5 Star Commercial Roofing",52,"roofing advice for Texas homeowners. Guides on hail damage, roof costs, materials, maintenance, and insurance claims from West Texas roofing professionals.",155,true,""
"https://5starroofingpros.comapp/blog/roof-maintenance-checklist-texas/","Roof Maintenance Checklist for Texas Homeowners 2025",52,"Complete roof maintenance checklist for Texas homes. Seasonal inspections, preventive care, and expert tips to extend roof life. Free printable checklist.",154,true,""
"https://5starroofingpros.comapp/blog/roof-replacement-cost-texas-2025/","Roof Replacement Cost in Texas 2025 | Complete Pricing Guide",60,"How much does roof replacement cost in Texas? Complete 2025 pricing guide with average costs by size, material, and location.",125,true,""
"https://5starroofingpros.comapp/borger-texas-roofing/","Roofing in Borger, TX| Hail Damage Specialists | 5 Star",55,"roofing services in Borger, Texas Panhandle. Commercial, residential, and emergency roofing. Serving Hutchinson County. Free inspections available.",147,true,""
"https://5starroofingpros.comapp/budgeting-for-roof-replacement-expenses/","Budgeting for Roof Replacement Expenses| Amarillo Roofing",57,"Affordable and reliable roof replacement services in Amarillo, TX. FREE inspections and estimates so you can budget exactly what it will cost you.",146,true,""
"https://5starroofingpros.comapp/bushland-tx-roofing/","Roofing in Bushland, TX| Hail Damage Specialists | 5 Star",57,"roofing services in Bushland, Texas Panhandle. Just 10 miles west of Amarillo. Hail damage repair, residential & commercial roofing, metal roofs.",145,true,""
"https://5starroofingpros.comapp/canyon-texas-roofing/","Roofing in Canyon, TX| Hail Damage Specialists | 5 Star",55,"roofing services in Canyon, Texas Panhandle. Commercial, residential, and emergency roofing. Serving Randall County. Free inspections available.",144,true,""
"https://5starroofingpros.comapp/canyon-tx-roofing/","Canyon TX Roofing | Professional Roofer Serving Canyon,",55,"Trusted roofing contractor serving Canyon, TX from our Amarillo location. hail damage repair, residential & commercial roofing.",127,true,""
"https://5starroofingpros.comapp/claude-tx-roofing/","Roofing in Claude, TX| Hail Damage Specialists | 5 Star",55,"roofing services in Claude, Texas Panhandle. Just 25 miles east of Amarillo on US-287. Hail damage repair, residential & commercial roofing.",140,true,""
"https://5starroofingpros.comapp/commercial-roof-repair-in-amarillo/","Commercial Roof Repair in AmarilloService | 5 Star",50,"Roof Repair in Amarillo, TX. Free inspections, insurance claim help, fast response. Call 5 Star Roofing for a free quote today!",127,true,""
"https://5starroofingpros.comapp/commercial-roofing/","Commercial Roofing in Amarillo TX| TPO, PVC, EPDM | 5 Star",58,"commercial roofing in Amarillo. TPO, PVC, EPDM, and built-up roofing systems. Call for a free quote!",100,true,"SHORT_META"
"https://5starroofingpros.comapp/commercial-roofing-amarillo/","Commercial Roofing Amarillo TX | 5 Star Roofing",47,"Commercial Roofing in Amarillo, TX. Free inspections, insurance claim help, fast response. Call 5 Star Roofing for a free quote today!",134,true,""
"https://5starroofingpros.comapp/commercial-roofing-amarillo-tx/","Amarillo TX Roofing | Trusted Local Roofers",43,"Commercial Roofing in Amarillo, TX. Free inspections, insurance claim help, fast response. Call 5 Star Roofing for a free quote today!",134,true,""
"https://5starroofingpros.comapp/commercial-roofing-andrews/","Commercial Roofing Andrews TX | 5 Star Roofing",46,"Professional commercial roofing in Andrews TX. Expert installation, 24/7 emergency service, insurance assistance. Free inspections. Call (806) 622-6041",151,true,""
"https://5starroofingpros.comapp/commercial-roofing-big-spring/","Commercial Roofing Big Spring TX | 5 Star Roofing",49,"Professional commercial roofing in Big Spring TX. Expert installation, 24/7 emergency service, insurance assistance. Free inspections. Call (806) 622-6041",154,true,""
"https://5starroofingpros.comapp/commercial-roofing-borger/","Commercial Roofing Borger TX | 5 Star Roofing",45,"Professional commercial roofing in Borger TX. Expert installation, 24/7 emergency service, insurance assistance. Free inspections. Call (806) 622-6041",150,true,""
"https://5starroofingpros.comapp/commercial-roofing-canyon/","Commercial Roofing Canyon TX | 5 Star Roofing",45,"Professional commercial roofing in Canyon TX. Expert installation, 24/7 emergency service, insurance assistance. Free inspections. Call (806) 622-6041",150,true,""
"https://5starroofingpros.comapp/commercial-roofing-dumas/","Commercial Roofing Dumas TX | 5 Star Roofing",44,"Professional commercial roofing in Dumas TX. Expert installation, 24/7 emergency service, insurance assistance. Free inspections. Call (806) 622-6041",149,true,""
"https://5starroofingpros.comapp/commercial-roofing-levelland/","Commercial Roofing Levelland TX | 5 Star Roofing",48,"Professional commercial roofing in Levelland TX. Expert installation, 24/7 emergency service, insurance assistance. Free inspections. Call (806) 622-6041",153,true,""
"https://5starroofingpros.comapp/commercial-roofing-lubbock/","Commercial Roofing Lubbock TX | 5 Star Roofing",46,"commercial roofing in Lubbock TX. TPO, EPDM, and metal roofing systems for businesses. 24/7 emergency service. Free inspections. Call (806) 622-6041",148,true,""
"https://5starroofingpros.comapp/commercial-roofing-lubbock-texas/","Commercial Roofing in Lubbock TX| TPO, EPDM, Flat Roofs",55,"Commercial Roofing in Lubbock, TX. Free inspections, insurance claim help, fast response. Call 5 Star Roofing for a free quote today!",133,true,""
"https://5starroofingpros.comapp/commercial-roofing-midland/","Commercial Roofing Midland TX | 5 Star Roofing",46,"commercial roofing in Midland TX. TPO, EPDM, and metal roofing systems for businesses. 24/7 emergency service. Free inspections. Call (806) 622-6041",148,true,""
"https://5starroofingpros.comapp/commercial-roofing-midland-texas/","Commercial Roofing in Midland TX| Oil & Gas Specialists",55,"Commercial Roofing in Midland, TX. Free inspections, insurance claim help, fast response. Call 5 Star Roofing for a free quote today!",133,true,""
"https://5starroofingpros.comapp/commercial-roofing-monahans/","Commercial Roofing Monahans TX | 5 Star Roofing",47,"Professional commercial roofing in Monahans TX. Expert installation, 24/7 emergency service, insurance assistance. Free inspections. Call (806) 622-6041",152,true,""
"https://5starroofingpros.comapp/commercial-roofing-odessa/","Commercial Roofing Odessa TX | 5 Star Roofing",45,"Professional commercial roofing in Odessa TX. TPO, EPDM, and metal roofing systems for businesses. 24/7 emergency service. Free inspections. Call (806) 622-6041",160,true,""
"https://5starroofingpros.comapp/commercial-roofing-odessa-texas/","Commercial Roofing Odessa TX | 5 Star Roofing",45,"Expert commercial roofing in Odessa, TX. TPO, EPDM, flat roof systems for Permian Basin businesses. Free estimates. Call (806) 622-6041.",136,true,""
"https://5starroofingpros.comapp/commercial-roofing-pampa/","Commercial Roofing Pampa TX | 5 Star Roofing",44,"Professional commercial roofing in Pampa TX. Expert installation, 24/7 emergency service, insurance assistance. Free inspections. Call (806) 622-6041",149,true,""
"https://5starroofingpros.comapp/commercial-roofing-perryton/","Commercial Roofing Perryton TX | 5 Star Roofing",47,"Professional commercial roofing in Perryton TX. Expert installation, 24/7 emergency service, insurance assistance. Free inspections. Call (806) 622-6041",152,true,""
"https://5starroofingpros.comapp/commercial-roofing-snyder/","Commercial Roofing Snyder TX | 5 Star Roofing",45,"Professional commercial roofing in Snyder TX. Expert installation, 24/7 emergency service, insurance assistance. Free inspections. Call (806) 622-6041",150,true,""
"https://5starroofingpros.comapp/contact/","Contact Us | 5 Star Commercial Roofing | Amarillo, TX",53,"Contact 5 Star Commercial Roofing for roofing services in Amarillo, Midland, Odessa, and West Texas.",100,true,"SHORT_META"
"https://5starroofingpros.comapp/damaged-roof-replacement-in-amarillo/","Damaged Roof Replacement Amarillo TX | 5 Star",45,"Professional roof repair or replacement in Amarillo. Storm damage, hail damage specialists. Don",95,true,"SHORT_META"
"https://5starroofingpros.comapp/dumas-texas-roofing/","Roofing in Dumas, TX| Hail Damage Specialists | 5 Star",54,"roofing services in Dumas, Texas Panhandle. Residential, commercial, and hail damage repair. Serving Moore County. Free inspections available.",142,true,""
"https://5starroofingpros.comapp/emergency-roof-repair-amarillo/","Emergency Roof Repair Amarillo TXService | Storm Damage",55,"Emergency Roof Repair in Amarillo, TX. Free inspections, insurance claim help, fast response. Call 5 Star Roofing for a free quote today!",137,true,""
"https://5starroofingpros.comapp/emergency-roof-repair-andrews/","Emergency Roof Repair Andrews TX | 5 Star Roofing",49,"Professional emergency roof repair in Andrews TX. Expert installation, 24/7 emergency service, insurance assistance. Free inspections. Call (806) 622-6041",154,true,""
"https://5starroofingpros.comapp/emergency-roof-repair-big-spring/","Emergency Roof Repair Big Spring TX | 5 Star Roofing",52,"Professional emergency roof repair in Big Spring TX. Expert installation, 24/7 emergency service, insurance assistance. Free inspections. Call (806) 622-6041",157,true,""
"https://5starroofingpros.comapp/emergency-roof-repair-borger/","Emergency Roof Repair Borger TX | 5 Star Roofing",48,"Professional emergency roof repair in Borger TX. Expert installation, 24/7 emergency service, insurance assistance. Free inspections. Call (806) 622-6041",153,true,""
"https://5starroofingpros.comapp/emergency-roof-repair-canyon/","Emergency Roof Repair Canyon TX | 5 Star Roofing",48,"Professional emergency roof repair in Canyon TX. Expert installation, 24/7 emergency service, insurance assistance. Free inspections. Call (806) 622-6041",153,true,""
"https://5starroofingpros.comapp/emergency-roof-repair-dumas/","Emergency Roof Repair Dumas TX | 5 Star Roofing",47,"Professional emergency roof repair in Dumas TX. Expert installation, 24/7 emergency service, insurance assistance. Free inspections. Call (806) 622-6041",152,true,""
"https://5starroofingpros.comapp/emergency-roof-repair-levelland/","Emergency Roof Repair Levelland TX | 5 Star Roofing",51,"Professional emergency roof repair in Levelland TX. Expert installation, 24/7 emergency service, insurance assistance. Free inspections. Call (806) 622-6041",156,true,""
"https://5starroofingpros.comapp/emergency-roof-repair-lubbock/","Emergency Roof Repair Lubbock TXService | Storm Damage",54,"24/7 emergency roof repair in Lubbock TX. Rapid response for storm damage, active leaks, wind damage. Emergency tarping available. Call (806) 622-6041",150,true,""
"https://5starroofingpros.comapp/emergency-roof-repair-midland/","Emergency Roof Repair Midland TXService | Storm Damage",54,"24/7 emergency roof repair in Midland TX. Rapid response for storm damage, active leaks, wind damage. Emergency tarping available. Call (806) 622-6041",150,true,""
"https://5starroofingpros.comapp/emergency-roof-repair-monahans/","Emergency Roof Repair Monahans TX | 5 Star Roofing",50,"Professional emergency roof repair in Monahans TX. Expert installation, 24/7 emergency service, insurance assistance. Free inspections. Call (806) 622-6041",155,true,""
"https://5starroofingpros.comapp/emergency-roof-repair-odessa/","Emergency Roof Repair Odessa TXService | Storm Damage",53,"24/7 emergency roof repair in Odessa TX. Rapid response for storm damage, active leaks, wind damage. Emergency tarping available. Call (806) 622-6041",149,true,""
"https://5starroofingpros.comapp/emergency-roof-repair-odessa-texas/","Emergency Roof Repair in Odessa | 5 Star",40,"Emergency Roof Repair in Odessa, TX. Free inspections, insurance claim help, fast response. Call 5 Star Roofing for a free quote today!",135,true,""
"https://5starroofingpros.comapp/emergency-roof-repair-pampa/","Emergency Roof Repair Pampa TX | 5 Star Roofing",47,"Professional emergency roof repair in Pampa TX. Expert installation, 24/7 emergency service, insurance assistance. Free inspections. Call (806) 622-6041",152,true,""
"https://5starroofingpros.comapp/emergency-roof-repair-perryton/","Emergency Roof Repair Perryton TX | 5 Star Roofing",50,"Professional emergency roof repair in Perryton TX. Expert installation, 24/7 emergency service, insurance assistance. Free inspections. Call (806) 622-6041",155,true,""
"https://5starroofingpros.comapp/emergency-roof-repair-snyder/","Emergency Roof Repair Snyder TX | 5 Star Roofing",48,"Professional emergency roof repair in Snyder TX. Expert installation, 24/7 emergency service, insurance assistance. Free inspections. Call (806) 622-6041",153,true,""
"https://5starroofingpros.comapp/expert-roofing-services-in-amarillo/","Amarillo TX Roofing Services | 5 Star Roofing",45,"Choose 5 Star Roofing for top-notch residential and commercial roofing services in Amarillo. Quality materials, expert service, and unbeatable reliability.",155,true,""
"https://5starroofingpros.comapp/flat-roof-repair-midland-texas/","Flat Roof Repair in Midland, TX| Commercial Specialists",55,"Expert flat roof repair in Midland, Texas. TPO, EPDM, membrane repairs, leak detection. Emergency service available. Free inspections. Call today (806) 622-6041",160,true,""
"https://5starroofingpros.comapp/gallery/","Project Gallery | 5 Star Commercial Roofing Portfolio",53,"View our completed roofing projects in Amarillo, Midland, Odessa, and Lubbock. Call for a free quote!",101,true,"SHORT_META"
"https://5starroofingpros.comapp/hail-damage-repair-amarillo/","Hail Damage Repair Amarillo TX | 5 Star Roofing",47,"Hail Damage Repair in Amarillo, TX. Free inspections, insurance claim help, fast response. Call 5 Star Roofing for a free quote today!",134,true,""
"https://5starroofingpros.comapp/hail-damage-repair-amarillo-tx/","Hail Damage Roof Repair in Amarillo | 5 Star",44,"Amarillo",8,true,"SHORT_META"
"https://5starroofingpros.comapp/hail-damage-repair-andrews/","Hail Damage Repair Andrews TX | 5 Star Roofing",46,"Professional hail damage repair in Andrews TX. Expert installation, 24/7 emergency service, insurance assistance. Free inspections. Call (806) 622-6041",151,true,""
"https://5starroofingpros.comapp/hail-damage-repair-big-spring/","Hail Damage Repair Big Spring TX | 5 Star Roofing",49,"Professional hail damage repair in Big Spring TX. Expert installation, 24/7 emergency service, insurance assistance. Free inspections. Call (806) 622-6041",154,true,""
"https://5starroofingpros.comapp/hail-damage-repair-borger/","Hail Damage Repair Borger TX | 5 Star Roofing",45,"Professional hail damage repair in Borger TX. Expert installation, 24/7 emergency service, insurance assistance. Free inspections. Call (806) 622-6041",150,true,""
"https://5starroofingpros.comapp/hail-damage-repair-canyon/","Hail Damage Repair Canyon TX | 5 Star Roofing",45,"Professional hail damage repair in Canyon TX. Expert installation, 24/7 emergency service, insurance assistance. Free inspections. Call (806) 622-6041",150,true,""
"https://5starroofingpros.comapp/hail-damage-repair-dumas/","Hail Damage Repair Dumas TX | 5 Star Roofing",44,"Professional hail damage repair in Dumas TX. Expert installation, 24/7 emergency service, insurance assistance. Free inspections. Call (806) 622-6041",149,true,""
"https://5starroofingpros.comapp/hail-damage-repair-levelland/","Hail Damage Repair Levelland TX | 5 Star Roofing",48,"Professional hail damage repair in Levelland TX. Expert installation, 24/7 emergency service, insurance assistance. Free inspections. Call (806) 622-6041",153,true,""
"https://5starroofingpros.comapp/hail-damage-repair-lubbock/","Hail Damage Repair Lubbock TX | 5 Star Roofing",46,"Expert hail damage repair in Lubbock with 24/7 emergency service. Complete insurance claim assistance. Free inspections. Call (806) 622-6041",140,true,""
"https://5starroofingpros.comapp/hail-damage-repair-lubbock-tx/","Hail Damage Roof Repair in Lubbock | 5 Star",43,"Lubbock",7,true,"SHORT_META"
"https://5starroofingpros.comapp/hail-damage-repair-midland/","Hail Damage Repair Midland TX | 5 Star Roofing",46,"Expert hail damage repair in Midland with 24/7 emergency service. Complete insurance claim assistance. Free inspections. Call (806) 622-6041",140,true,""
"https://5starroofingpros.comapp/hail-damage-repair-midland-tx/","Hail Damage Roof Repair in Midland | 5 Star",43,"Midland",7,true,"SHORT_META"
"https://5starroofingpros.comapp/hail-damage-repair-monahans/","Hail Damage Repair Monahans TX | 5 Star Roofing",47,"Professional hail damage repair in Monahans TX. Expert installation, 24/7 emergency service, insurance assistance. Free inspections. Call (806) 622-6041",152,true,""
"https://5starroofingpros.comapp/hail-damage-repair-odessa/","Hail Damage Roof Repair Odessa TXEmergency | Free Inspection",60,"Expert hail damage repair in Odessa with 24/7 emergency service. Complete insurance claim assistance. Free inspections. Call (806) 622-6041",139,true,""
"https://5starroofingpros.comapp/hail-damage-repair-odessa-tx/","Hail Damage Roof Repair in Odessa | 5 Star",42,"Odessa",6,true,"SHORT_META"
"https://5starroofingpros.comapp/hail-damage-repair-pampa/","Hail Damage Repair Pampa TX | 5 Star Roofing",44,"Professional hail damage repair in Pampa TX. Expert installation, 24/7 emergency service, insurance assistance. Free inspections. Call (806) 622-6041",149,true,""
"https://5starroofingpros.comapp/hail-damage-repair-perryton/","Hail Damage Repair Perryton TX | 5 Star Roofing",47,"Professional hail damage repair in Perryton TX. Expert installation, 24/7 emergency service, insurance assistance. Free inspections. Call (806) 622-6041",152,true,""
"https://5starroofingpros.comapp/hail-damage-repair-snyder/","Hail Damage Repair Snyder TX | 5 Star Roofing",45,"Professional hail damage repair in Snyder TX. Expert installation, 24/7 emergency service, insurance assistance. Free inspections. Call (806) 622-6041",150,true,""
"https://5starroofingpros.comapp/hail-damage-roof-repair-amarillo-texas/","Hail Damage Roof Repair in Amarillo | 5 Star",44,"Hail Damage Repair in Amarillo, TX. Free inspections, insurance claim help, fast response. Call 5 Star Roofing for a free quote today!",134,true,""
"https://5starroofingpros.comapp/hail-damage-roof-repair-in-amarillo/","Hail Damage Roof Repair in Amarillo | 5 Star",44,"Hail Damage Repair in Amarillo, TX. Free inspections, insurance claim help, fast response. Call 5 Star Roofing for a free quote today!",134,true,""
"https://5starroofingpros.comapp/hail-damage-roof-repair-lubbock-texas/","Hail Damage Roof Repair in Lubbock | 5 Star",43,"Hail Damage Repair in Lubbock, TX. Free inspections, insurance claim help, fast response. Call 5 Star Roofing for a free quote today!",133,true,""
"https://5starroofingpros.comapp/hail-damage-roof-repair-midland-texas/","Hail Damage Roof Repair in Midland | 5 Star",43,"Hail Damage Repair in Midland, TX. Free inspections, insurance claim help, fast response. Call 5 Star Roofing for a free quote today!",133,true,""
