URL,Title,Title Length,Meta Description,Meta Length,Has Schema,Issues
"https://5starroofingpros.comapp/roof-replacement-levelland/","Roof Replacement Levelland TX | 5 Star Roofing",46,"Professional roof replacement in Levelland TX. Expert installation, 24/7 emergency service, insurance assistance. Free inspections. Call (806) 622-6041",151,true,""
"https://5starroofingpros.comapp/roof-replacement-lubbock/","Roof Replacement Lubbock TX | 5 Star Roofing",44,"Expert roof replacement in Lubbock TX. Class 4 impact-resistant shingles. Insurance claims assistance. Call (806) 622-6041",122,true,""
"https://5starroofingpros.comapp/roof-replacement-midland/","Roof Replacement Midland TX | 5 Star Roofing",44,"Expert roof replacement in Midland TX. Class 4 impact-resistant shingles. Insurance claims assistance. Call (806) 622-6041",122,true,""
"https://5starroofingpros.comapp/roof-replacement-monahans/","Roof Replacement Monahans TX | 5 Star Roofing",45,"Professional roof replacement in Monahans TX. Expert installation, 24/7 emergency service, insurance assistance. Free inspections. Call (806) 622-6041",150,true,""
"https://5starroofingpros.comapp/roof-replacement-odessa/","Roof Replacement Odessa TX | 5 Star Roofing",43,"Expert roof replacement in Odessa TX. Class 4 impact-resistant shingles. Insurance claims assistance. Call (806) 622-6041",121,true,""
"https://5starroofingpros.comapp/roof-replacement-pampa/","Roof Replacement Pampa TX | Expert Service | Free Inspection",60,"Professional roof replacement in Pampa TX. Expert installation, 24/7 emergency service, insurance assistance. Free inspections. Call (806) 622-6041",147,true,""
"https://5starroofingpros.comapp/roof-replacement-perryton/","Roof Replacement Perryton TX | 5 Star Roofing",45,"Professional roof replacement in Perryton TX. Expert installation, 24/7 emergency service, insurance assistance. Free inspections. Call (806) 622-6041",150,true,""
"https://5starroofingpros.comapp/roof-replacement-snyder/","Roof Replacement Snyder TX | 5 Star Roofing",43,"Professional roof replacement in Snyder TX. Expert installation, 24/7 emergency service, insurance assistance. Free inspections. Call (806) 622-6041",148,true,""
"https://5starroofingpros.comapp/roof-rot-damage-in-amarillo/","Roof Rot Damage Repair in Amarillo TX| Wood Rot Specialists",59,"roof rot damage repair in Amarillo. Wood rot removal, deck replacement, and moisture solutions. Free inspections and insurance claims help.",139,true,""
"https://5starroofingpros.comapp/roof-snow-and-ice-damage-in-amarillo/","Emergency Snow & Ice Damage Roof Repair in Amarillo",51,"Snow and ice damage roof emergency in Amarillo? We respond 24/7. Ice dam removal, freeze-thaw damage repair, and emergency tarping. Same-day inspections.",153,true,""
"https://5starroofingpros.comapp/roof-storm-damage-in-amarillo/","Emergency Storm Damage Roof Repair in Amarillo | 5 Star",55,"Storm Damage Repair in Amarillo, TX. Free inspections, insurance claim help, fast response. Call 5 Star Roofing for a free quote today!",135,true,""
"https://5starroofingpros.comapp/roof-wind-damage-in-amarillo/","Emergency Wind Damage Roof Repair in Amarillo | 5 Star",54,"Wind Damage Repair in Amarillo, TX. Free inspections, insurance claim help, fast response. Call 5 Star Roofing for a free quote today!",134,true,""
"https://5starroofingpros.comapp/roofers-in-amarillo/","Best Roofers in Amarillo TX | 5 Star Roofing",44,"roofers in Amarillo, TX. Our roofing services meet all your needs. We provide top-quality solutions to ensure the best property protection.",139,true,""
"https://5starroofingpros.comapp/roofing-amarillo-tx/","Amarillo TX Roofing | Trusted Local Roofers",43,"roofing in Amarillo specializing in hail damage repair and storm restoration. Amarillo experiences 8-12 hailstorms annually.",124,true,""
"https://5starroofingpros.comapp/roofing-companies-in-amarillo-tx/","Top Roofing Companies in Amarillo TX | Free Inspection Today",60,"Looking for roofing companies in Amarillo TX? Our roofing contractors offer affordable roof repair and top-notch residential roofing services.",142,true,""
"https://5starroofingpros.comapp/roofing-methods/","Roofing Methods & Installation in Amarillo| Hail-Resistan...",60,"Modern roofing methods for Texas Panhandle homes and businesses. Impact-resistant shingles, standing seam metal, TPO systems. hail damage prevention.",149,true,""
"https://5starroofingpros.comapp/roofing-methods-in-amarillo/","Roofing Methods & Materials Amarillo TX | 5 Star",48,"Discover proven roofing methods and installation techniques for Amarillo homes. Impact-resistant systems, proper ventilation, and hail protection.",146,true,""
"https://5starroofingpros.comapp/roofing-repair-services-in-amarillo/","Roof Repair Services Amarillo TX | 5 Star",41,"roofing repair services in Amarillo. Fast emergency repairs, leak detection, shingle replacement, storm damage. Licensed & insured. Free inspections.",149,true,""
"https://5starroofingpros.comapp/roofing-services-in-amarillo-tx/","Amarillo TX Roofing Services | 5 Star Roofing",45,"Complete roofing services in Amarillo, TX. Residential & commercial, repair & replacement, hail damage, emergency service. Free inspections. Call (806) 622-6041",160,true,""
"https://5starroofingpros.comapp/roofing-services-lubbock-tx/","Roofing Contractor Lubbock TX | 5 Star",38,"roofing services in Lubbock, TX. Hail damage repair, storm restoration, Class 4 shingles, TPO, metal roofing. Free inspections. Insurance claims help.",150,false,"NO_SCHEMA"
"https://5starroofingpros.comapp/service-areas/","Service Areas | Amarillo, Midland, Odessa Roofing | & West",58,"roofing services across West Texas. Serving Amarillo, Midland, Odessa, Lubbock, and 20+ Texas Panhandle cities. Hail damage specialists. Call (806) 622-6041",156,true,""
"https://5starroofingpros.comapp/services/","Roofing Services in Amarillo, Midland, Odessa| Hail Damag...",60,"Complete roofing services for West Texas including residential, commercial, and industrial. Call for a free quote!",114,true,"SHORT_META"
"https://5starroofingpros.comapp/storm-damage-repair-amarillo/","Storm Damage Roof Repair Amarillo TXEmergency | 5 Star",54,"Storm Damage Repair in Amarillo, TX. Free inspections, insurance claim help, fast response. Call 5 Star Roofing for a free quote today!",135,true,""
"https://5starroofingpros.comapp/storm-damage-repair-andrews/","Storm Damage Repair Andrews TX | 5 Star Commercial Roofing",58,"Expert storm damage roof repair in Andrews TX. Permian Basin experiences 6-8 hailstorms annually. Free inspections. Call (806) 622-6041",135,true,""
"https://5starroofingpros.comapp/storm-damage-repair-big-spring/","Storm Damage Repair Big Spring TX | 5 Star Roofing",50,"Expert storm damage roof repair in Big Spring TX. West Texas experiences 7-9 hailstorms annually. Free inspections. Call (806) 622-6041",135,true,""
"https://5starroofingpros.comapp/storm-damage-repair-borger/","Storm Damage Repair Borger TXService | Free Inspection",54,"storm damage roof repair in Borger TX. Texas Panhandle experiences 6-8 hailstorms annually. High Plains winds 60+ mph. Free inspections. Call (806) 622-6041",156,true,""
"https://5starroofingpros.comapp/storm-damage-repair-canyon/","Storm Damage Repair Canyon TXService | Free Inspection",54,"storm damage roof repair in Canyon TX. Texas Panhandle experiences 6-8 hailstorms annually. High Plains winds 60+ mph. Free inspections. Call (806) 622-6041",156,true,""
"https://5starroofingpros.comapp/storm-damage-repair-dumas/","Storm Damage Repair Dumas TXService | Free Inspection",53,"storm damage roof repair in Dumas TX. Texas Panhandle experiences 6-8 hailstorms annually. High Plains winds 60+ mph. Free inspections. Call (806) 622-6041",155,true,""
"https://5starroofingpros.comapp/storm-damage-repair-levelland/","Storm Damage Repair Levelland TX | 5 Star Commercial Roofing",60,"Expert storm damage roof repair in Levelland TX. South Plains experiences 7-10 hailstorms annually. Free inspections. Call (806) 622-6041",137,true,""
"https://5starroofingpros.comapp/storm-damage-repair-lubbock/","Storm Damage Repair Lubbock | 5 Star Commercial Roofing",55,"Expert storm damage repair in Lubbock. 24/7 emergency service for hail, wind, and weather damage. Complete insurance assistance. Call (806) 622-6041",148,true,""
"https://5starroofingpros.comapp/storm-damage-repair-midland/","Storm Damage Repair Midland | 5 Star Commercial Roofing",55,"Expert storm damage repair in Midland. 24/7 emergency service for hail, wind, and weather damage. Complete insurance assistance. Call (806) 622-6041",148,true,""
"https://5starroofingpros.comapp/storm-damage-repair-monahans/","Storm Damage Repair Monahans TX | 5 Star Commercial Roofing",59,"Expert storm damage roof repair in Monahans TX. Permian Basin experiences 6-8 hailstorms annually. Free inspections. Call (806) 622-6041",136,true,""
"https://5starroofingpros.comapp/storm-damage-repair-odessa/","Storm Damage Repair Odessa | 5 Star Commercial Roofing",54,"Expert storm damage repair in Odessa. 24/7 emergency service for hail, wind, and weather damage. Complete insurance assistance. Call (806) 622-6041",147,true,""
"https://5starroofingpros.comapp/storm-damage-repair-pampa/","Storm Damage Repair Pampa TXService | Free Inspection",53,"storm damage roof repair in Pampa TX. Texas Panhandle experiences 6-8 hailstorms annually. High Plains winds 60+ mph. Free inspections. Call (806) 622-6041",155,true,""
"https://5starroofingpros.comapp/storm-damage-repair-perryton/","Storm Damage Roof Repair Perryton TXEmergency | 5 Star",54,"Storm Damage Repair in Perryton, TX. Free inspections, insurance claim help, fast response. Call 5 Star Roofing for a free quote today!",135,true,""
"https://5starroofingpros.comapp/storm-damage-repair-snyder/","Storm Damage Repair Snyder TX | 5 Star Commercial Roofing",57,"Expert storm damage roof repair in Snyder TX. West Texas experiences 7-9 hailstorms annually. Free inspections. Call (806) 622-6041",131,true,""
"https://5starroofingpros.comapp/storm-damage-roof-repair-in-amarillo/","Emergency Storm Damage Roof Repair in Amarillo | 5 Star",55,"Storm Damage Repair in Amarillo, TX. Free inspections, insurance claim help, fast response. Call 5 Star Roofing for a free quote today!",135,true,""
"https://5starroofingpros.comapp/tpo-roofing-amarillo/","TPO Roofing Amarillo TX | Expert Service | Free Inspection",58,"Professional tpo roofing in Amarillo TX. Expert installation, 24/7 emergency service, insurance assistance. Free inspections. Call (806) 622-6041",145,true,""
"https://5starroofingpros.comapp/tpo-roofing-andrews/","TPO Roofing Andrews TX | 5 Star Commercial Roofing",50,"Expert TPO roofing installation in Andrews TX. Permian Basin experiences 6-8 hailstorms annually. Free inspections. Call (806) 622-6041",135,true,""
"https://5starroofingpros.comapp/tpo-roofing-big-spring/","TPO Roofing Big Spring TX | 5 Star Commercial Roofing",53,"Expert TPO roofing installation in Big Spring TX. West Texas experiences 7-9 hailstorms annually. Free inspections. Call (806) 622-6041",135,true,""
"https://5starroofingpros.comapp/tpo-roofing-borger/","TPO Roofing Borger TX | 5 Star Roofing",38,"Expert tpo roofing in Borger TX. Texas Panhandle experiences 7-9 hailstorms annually. Refinery town. Free inspections. Call (806) 622-6041",138,true,""
"https://5starroofingpros.comapp/tpo-roofing-canyon/","TPO Roofing Canyon TX | 5 Star Roofing",38,"Expert tpo roofing in Canyon TX. Texas Panhandle experiences 8-10 hailstorms annually. Palo Duro Canyon, WTAMU. Free inspections. Call (806) 622-6041",149,true,""
"https://5starroofingpros.comapp/tpo-roofing-dumas/","TPO Roofing Dumas TX | Commercial Systems | Energy Efficient",60,"Expert tpo roofing in Dumas TX. Texas Panhandle experiences 7-9 hailstorms annually. Agricultural center. Free inspections. Call (806) 622-6041",143,true,""
"https://5starroofingpros.comapp/tpo-roofing-levelland/","TPO Roofing Levelland TX | 5 Star Commercial Roofing",52,"Expert TPO roofing installation in Levelland TX. South Plains experiences 7-10 hailstorms annually. Free inspections. Call (806) 622-6041",137,true,""
"https://5starroofingpros.comapp/tpo-roofing-lubbock/","TPO Roofing Lubbock TX | Expert Service | Free Inspection",57,"Professional tpo roofing in Lubbock TX. Expert installation, 24/7 emergency service, insurance assistance. Free inspections. Call (806) 622-6041",144,true,""
"https://5starroofingpros.comapp/tpo-roofing-midland/","TPO Roofing Midland TX | Expert Service | Free Inspection",57,"Professional tpo roofing in Midland TX. Expert installation, 24/7 emergency service, insurance assistance. Free inspections. Call (806) 622-6041",144,true,""
"https://5starroofingpros.comapp/tpo-roofing-monahans/","TPO Roofing Monahans TX | 5 Star Commercial Roofing",51,"Expert TPO roofing installation in Monahans TX. Permian Basin experiences 6-8 hailstorms annually. Free inspections. Call (806) 622-6041",136,true,""
"https://5starroofingpros.comapp/tpo-roofing-odessa/","TPO Roofing Odessa TX | Expert Service | Free Inspection",56,"Professional tpo roofing in Odessa TX. Expert installation, 24/7 emergency service, insurance assistance. Free inspections. Call (806) 622-6041",143,true,""
"https://5starroofingpros.comapp/tpo-roofing-pampa/","TPO Roofing Pampa TX | Commercial Systems | Energy Efficient",60,"Expert tpo roofing in Pampa TX. Texas Panhandle experiences 7-9 hailstorms annually. Ranching and oil industry. Free inspections. Call (806) 622-6041",149,true,""
"https://5starroofingpros.comapp/tpo-roofing-perryton/","TPO Roofing Perryton TX | 5 Star Roofing",40,"Expert tpo roofing in Perryton TX. Texas Panhandle experiences 7-9 hailstorms annually. Wheat country. Free inspections. Call (806) 622-6041",140,true,""
"https://5starroofingpros.comapp/tpo-roofing-snyder/","TPO Roofing Snyder TX | 5 Star Commercial Roofing",49,"Expert TPO roofing installation in Snyder TX. West Texas experiences 7-9 hailstorms annually. Free inspections. Call (806) 622-6041",131,true,""
"https://5starroofingpros.comapp/vega-tx-roofing/","Roofing in Vega, TX| Hail Damage Specialists | 5 Star",53,"roofing services in Vega, Texas Panhandle. 35 miles west of Amarillo on I-40. Hail damage repair, residential & commercial roofing, metal roofs.",144,true,""
"https://5starroofingpros.comapp/wildorado-tx-roofing/","Roofing in Wildorado, TX| Hail Damage Specialists | 5 Star",58,"roofing services in Wildorado, Texas Panhandle. Just 15 miles west of Amarillo on I-40. Hail damage repair, residential & commercial roofing, metal roofs.",154,true,""
"https://5starroofingpros.comapp/wind-damage-repair-amarillo/","Wind Damage Repair Amarillo TX | 5 Star Roofing",47,"Wind Damage Repair in Amarillo, TX. Free inspections, insurance claim help, fast response. Call 5 Star Roofing for a free quote today!",134,true,""
"https://5starroofingpros.comapp/wind-damage-repair-andrews/","Wind Damage Repair Andrews TX | 5 Star Commercial Roofing",57,"Expert wind damage roof repair in Andrews TX. Permian Basin experiences 6-8 hailstorms annually. Free inspections. Call (806) 622-6041",134,true,""
"https://5starroofingpros.comapp/wind-damage-repair-big-spring/","Wind Damage Repair Big Spring TX | 5 Star Commercial Roofing",60,"Expert wind damage roof repair in Big Spring TX. West Texas experiences 7-9 hailstorms annually. Free inspections. Call (806) 622-6041",134,true,""
"https://5starroofingpros.comapp/wind-damage-repair-borger/","Wind Damage Repair Borger TXService | High Plains Winds",55,"wind damage roof repair in Borger TX. Texas Panhandle experiences 6-8 hailstorms annually. High Plains winds 60+ mph. Free inspections. Call (806) 622-6041",155,true,""
"https://5starroofingpros.comapp/wind-damage-repair-canyon/","Wind Damage Repair Canyon TXService | High Plains Winds",55,"wind damage roof repair in Canyon TX. Texas Panhandle experiences 6-8 hailstorms annually. High Plains winds 60+ mph. Free inspections. Call (806) 622-6041",155,true,""
"https://5starroofingpros.comapp/wind-damage-repair-dumas/","Wind Damage Repair Dumas TXService | High Plains Winds",54,"wind damage roof repair in Dumas TX. Texas Panhandle experiences 6-8 hailstorms annually. High Plains winds 60+ mph. Free inspections. Call (806) 622-6041",154,true,""
"https://5starroofingpros.comapp/wind-damage-repair-levelland/","Wind Damage Repair Levelland TX | 5 Star Commercial Roofing",59,"Expert wind damage roof repair in Levelland TX. South Plains experiences 7-10 hailstorms annually. Free inspections. Call (806) 622-6041",136,true,""
"https://5starroofingpros.comapp/wind-damage-repair-lubbock/","Wind Damage Repair Lubbock | 5 Star Commercial Roofing",54,"Wind damage repair in Lubbock. South Plains sustained winds with gusts over 70+ mph. 24/7 emergency service and insurance claim assistance. Call (806) 622-6041",159,true,""
"https://5starroofingpros.comapp/wind-damage-repair-midland/","Wind Damage Repair Midland | 5 Star Commercial Roofing",54,"Wind damage repair in Midland. Permian Basin sustained winds with gusts over 65+ mph. 24/7 emergency service and insurance claim assistance. Call (806) 622-6041",160,true,""
"https://5starroofingpros.comapp/wind-damage-repair-monahans/","Wind Damage Repair Monahans TX | 5 Star Commercial Roofing",58,"Expert wind damage roof repair in Monahans TX. Permian Basin experiences 6-8 hailstorms annually. Free inspections. Call (806) 622-6041",135,true,""
"https://5starroofingpros.comapp/wind-damage-repair-odessa/","Wind Damage Repair Odessa | 5 Star Commercial Roofing",53,"Wind damage repair in Odessa. Permian Basin sustained winds with gusts over 65+ mph. 24/7 emergency service and insurance claim assistance. Call (806) 622-6041",159,true,""
"https://5starroofingpros.comapp/wind-damage-repair-pampa/","Wind Damage Repair Pampa TXService | High Plains Winds",54,"wind damage roof repair in Pampa TX. Texas Panhandle experiences 6-8 hailstorms annually. High Plains winds 60+ mph. Free inspections. Call (806) 622-6041",154,true,""
"https://5starroofingpros.comapp/wind-damage-repair-perryton/","Wind Damage Repair Perryton TXService | High Plains Winds",57,"wind damage roof repair in Perryton TX. Texas Panhandle experiences 6-8 hailstorms annually. High Plains winds 60+ mph. Free inspections. Call (806) 622-6041",157,true,""
"https://5starroofingpros.comapp/wind-damage-repair-snyder/","Wind Damage Repair Snyder TX | 5 Star Commercial Roofing",56,"Expert wind damage roof repair in Snyder TX. West Texas experiences 7-9 hailstorms annually. Free inspections. Call (806) 622-6041",130,true,""
"https://5starroofingpros.comapp/wind-damage-roof-repair-in-amarillo/","Emergency Wind Damage Roof Repair in Amarillo | 5 Star",54,"Wind Damage Repair in Amarillo, TX. Free inspections, insurance claim help, fast response. Call 5 Star Roofing for a free quote today!",134,false,"NO_SCHEMA"