URL,Title,Title Length,Meta Description,Meta Length,Has Schema,Issues
"https://5starroofingpros.comapp/hail-damage-roof-repair-odessa-texas/","Hail Damage Roof Repair in Odessa | 5 Star",42,"Hail Damage Repair in Odessa, TX. Free inspections, insurance claim help, fast response. Call 5 Star Roofing for a free quote today!",132,true,""
"https://5starroofingpros.comapp/hail-damage-roof-replacement-in-amarillo/","Hail Damage Roof Replacement in Amarillo | 5 Star",49,"Hail Damage Repair in Amarillo, TX. Free inspections, insurance claim help, fast response. Call 5 Star Roofing for a free quote today!",134,true,""
"https://5starroofingpros.comapp/hail-damage-roofs-in-amarillo/","Hail Damage Roof Repair in Amarillo | 5 Star",44,"Hail Damage Repair in Amarillo, TX. Free inspections, insurance claim help, fast response. Call 5 Star Roofing for a free quote today!",134,true,""
"https://5starroofingpros.comapp/heavy-rain-damage-roof-repair-in-amarillo/","Emergency Rain Damage Roof Repair in Amarillo | 5 Star",54,"Roof Repair in Amarillo, TX. Free inspections, insurance claim help, fast response. Call 5 Star Roofing for a free quote today!",127,true,""
"https://5starroofingpros.comapp/hereford-texas-roofing/","Roofing in Hereford, TX| Hail Damage Specialists | 5 Star",57,"roofing services in Hereford, Texas Panhandle. Residential, commercial, and hail damage repair. Serving Deaf Smith County. Free inspections available.",150,true,""
"https://5starroofingpros.comapp/industrial-roofing/","Industrial Roofing in Amarillo TX| Warehouses & Manufactu...",60,"industrial roofing in Amarillo. TPO, EPDM, and metal roofing for warehouses and manufacturing facilities.",105,true,"SHORT_META"
"https://5starroofingpros.comapp/lubbock-tx-roofing/","Roofing in Lubbock TX | South Plains Weather Experts",52,"roofing in Lubbock. South Plains weather experts. Residential and commercial services. Lubbock experiences 6-8 hailstorms annually.",131,true,""
"https://5starroofingpros.comapp/metal-roof-installation-odessa-texas/","Metal Roof Installation in Odessa, TX| 50+ Year Lifespan",56,"metal roof installation in Odessa, Texas. Standing seam, R-panel, commercial & residential. 50+ year lifespan. Free inspections available.",138,true,""
"https://5starroofingpros.comapp/metal-roofing-amarillo/","Metal Roofing Amarillo TX | Expert Service | Free Inspection",60,"Professional metal roofing in Amarillo TX. Expert installation, 24/7 emergency service, insurance assistance. Free inspections. Call (806) 622-6041",147,true,""
"https://5starroofingpros.comapp/metal-roofing-andrews/","Metal Roofing Andrews TX | 5 Star Commercial Roofing",52,"Durable metal roofing systems in Andrews TX. Permian Basin experiences 6-8 hailstorms annually. Free inspections. Call (806) 622-6041",133,true,""
"https://5starroofingpros.comapp/metal-roofing-big-spring/","Metal Roofing Big Spring TX | 5 Star Commercial Roofing",55,"Durable metal roofing systems in Big Spring TX. West Texas experiences 7-9 hailstorms annually. Free inspections. Call (806) 622-6041",133,true,""
"https://5starroofingpros.comapp/metal-roofing-borger/","Metal Roofing Borger TX | Standing Seam | 50+ Year Lifespan",59,"Expert metal roofing in Borger TX. Texas Panhandle experiences 6-8 hailstorms annually. High Plains winds 60+ mph. Free inspections. Call (806) 622-6041",152,true,""
"https://5starroofingpros.comapp/metal-roofing-canyon/","Metal Roofing Canyon TX | Standing Seam | 50+ Year Lifespan",59,"Expert metal roofing in Canyon TX. Texas Panhandle experiences 6-8 hailstorms annually. High Plains winds 60+ mph. Free inspections. Call (806) 622-6041",152,true,""
"https://5starroofingpros.comapp/metal-roofing-dumas/","Metal Roofing Dumas TX | Standing Seam | 50+ Year Lifespan",58,"Expert metal roofing in Dumas TX. Texas Panhandle experiences 6-8 hailstorms annually. High Plains winds 60+ mph. Free inspections. Call (806) 622-6041",151,true,""
"https://5starroofingpros.comapp/metal-roofing-levelland/","Metal Roofing Levelland TX | 5 Star Commercial Roofing",54,"Durable metal roofing systems in Levelland TX. South Plains experiences 7-10 hailstorms annually. Free inspections. Call (806) 622-6041",135,true,""
"https://5starroofingpros.comapp/metal-roofing-lubbock/","Metal Roofing Lubbock TX | Expert Service | Free Inspection",59,"Professional metal roofing in Lubbock TX. Expert installation, 24/7 emergency service, insurance assistance. Free inspections. Call (806) 622-6041",146,true,""
"https://5starroofingpros.comapp/metal-roofing-midland/","Metal Roofing Midland TX | Expert Service | Free Inspection",59,"Professional metal roofing in Midland TX. Expert installation, 24/7 emergency service, insurance assistance. Free inspections. Call (806) 622-6041",146,true,""
"https://5starroofingpros.comapp/metal-roofing-monahans/","Metal Roofing Monahans TX | 5 Star Commercial Roofing",53,"Durable metal roofing systems in Monahans TX. Permian Basin experiences 6-8 hailstorms annually. Free inspections. Call (806) 622-6041",134,true,""
"https://5starroofingpros.comapp/metal-roofing-odessa/","Metal Roofing Odessa TX | Expert Service | Free Inspection",58,"Professional metal roofing in Odessa TX. Expert installation, 24/7 emergency service, insurance assistance. Free inspections. Call (806) 622-6041",145,true,""
"https://5starroofingpros.comapp/metal-roofing-pampa/","Metal Roofing Pampa TX | Standing Seam | 50+ Year Lifespan",58,"Expert metal roofing in Pampa TX. Texas Panhandle experiences 6-8 hailstorms annually. High Plains winds 60+ mph. Free inspections. Call (806) 622-6041",151,true,""
"https://5starroofingpros.comapp/metal-roofing-perryton/","Metal Roofing Perryton TX | 5 Star Roofing",42,"Expert metal roofing in Perryton TX. Texas Panhandle experiences 6-8 hailstorms annually. High Plains winds 60+ mph. Free inspections. Call (806) 622-6041",154,true,""
"https://5starroofingpros.comapp/metal-roofing-snyder/","Metal Roofing Snyder TX | 5 Star Commercial Roofing",51,"Durable metal roofing systems in Snyder TX. West Texas experiences 7-9 hailstorms annually. Free inspections. Call (806) 622-6041",129,true,""
"https://5starroofingpros.comapp/midland-tx-roofing/","Roofing in Midland TX | Oil & Gas Industry Specialists",54,"roofing in Midland including commercial and industrial. Permian Basin specialists. Chemical-resistant PVC systems for oil & gas facilities.",139,true,""
"https://5starroofingpros.comapp/odessa-tx-roofing/","Roofing Contractor Odessa TX | 5 Star",37,"Commercial and industrial roofing in Odessa. Permian Basin experts. Specialized systems for manufacturing and oil & gas facilities.",131,true,""
"https://5starroofingpros.comapp/","5 Star Commercial Roofing | Amarillo, Midland, Odessa Hai...",60,"West Texas",10,true,"SHORT_META"
"https://5starroofingpros.comapp/pampa-texas-roofing/","Roofing in Pampa, TX| Hail Damage Specialists | 5 Star",54,"roofing services in Pampa, Texas Panhandle. Commercial, residential, and emergency roofing. Serving Gray County. Free inspections available.",140,true,""
"https://5starroofingpros.comapp/perryton-texas-roofing/","Roofing in Perryton, TX| Hail Damage Specialists | 5 Star",57,"roofing services in Perryton, Texas Panhandle. Commercial, residential, and emergency roofing. Serving Ochiltree County. Free inspections available.",148,true,""
"https://5starroofingpros.comapp/plainview-texas-roofing/","Roofing in Plainview, TX| Hail Damage Specialists | 5 Star",58,"roofing services in Plainview, Texas Panhandle. Commercial, residential, and emergency roofing. Serving Hale County. Free inspections available.",144,true,""
"https://5starroofingpros.comapp/pvc-roof-repair-in-amarillo/","PVC Roof Repair Amarillo TX | 5 Star Roofing",44,"Roof Repair in Amarillo, TX. Free inspections, insurance claim help, fast response. Call 5 Star Roofing for a free quote today!",127,true,""
"https://5starroofingpros.comapp/pvc-roof-replacement-in-amarillo/","PVC Roof Replacement Amarillo TX | 5 Star",41,"Roof Replacement in Amarillo, TX. Free inspections, insurance claim help, fast response. Call 5 Star Roofing for a free quote today!",132,true,""
"https://5starroofingpros.comapp/pvc-roofing-contractors-in-amarillo/","PVC Roofing in Amarillo, TX| Commercial Experts | 5 Star",56,"PVC roofing installation in Amarillo, Midland, Odessa. Heat-welded seams, Class A fire rating, 20+ year warranties. Commercial roofing specialists.",147,true,""
"https://5starroofingpros.comapp/residential-roof-repair-in-amarillo/","Residential Roof Repair Amarillo TX | 5 Star",44,"Roof Repair in Amarillo, TX. Free inspections, insurance claim help, fast response. Call 5 Star Roofing for a free quote today!",127,true,""
"https://5starroofingpros.comapp/residential-roof-replacement-in-amarillo/","Residential Roof Replacement Amarillo TX",40,"Roof Replacement in Amarillo, TX. Free inspections, insurance claim help, fast response. Call 5 Star Roofing for a free quote today!",132,true,""
"https://5starroofingpros.comapp/residential-roofing/","Residential Roofing in Amarillo | 5 Star",40,"residential roofing in Amarillo. Asphalt shingles, metal roofing, and hail damage repair. Call for a free quote!",112,true,"SHORT_META"
"https://5starroofingpros.comapp/residential-roofing-amarillo/","Residential Roofing Amarillo TX | 5 Star Roofing",48,"Residential Roofing in Amarillo, TX. Free inspections, insurance claim help, fast response. Call 5 Star Roofing for a free quote today!",135,true,""
"https://5starroofingpros.comapp/residential-roofing-amarillo-texas/","Residential Roofing Amarillo TX | 5 Star Roofing",48,"Expert residential roofing services in Amarillo, Texas. Roof replacement, repair, and upgrades for Amarillo homes. Free estimates. Call (806) 622-6041.",151,true,""
"https://5starroofingpros.comapp/residential-roofing-amarillo-tx/","Amarillo TX Roofing | Trusted Local Roofers",43,"Amarillo",8,true,"SHORT_META"
"https://5starroofingpros.comapp/residential-roofing-andrews/","Residential Roofing Andrews TX | 5 Star Roofing",47,"Professional residential roofing in Andrews TX. Expert installation, 24/7 emergency service, insurance assistance. Free inspections. Call (806) 622-6041",152,true,""
"https://5starroofingpros.comapp/residential-roofing-big-spring/","Residential Roofing Big Spring TX | 5 Star Roofing",50,"Professional residential roofing in Big Spring TX. Expert installation, 24/7 emergency service, insurance assistance. Free inspections. Call (806) 622-6041",155,true,""
"https://5starroofingpros.comapp/residential-roofing-borger/","Residential Roofing Borger TX | 5 Star Roofing",46,"Professional residential roofing in Borger TX. Expert installation, 24/7 emergency service, insurance assistance. Free inspections. Call (806) 622-6041",151,true,""
"https://5starroofingpros.comapp/residential-roofing-canyon/","Residential Roofing Canyon TX | 5 Star Roofing",46,"Professional residential roofing in Canyon TX. Expert installation, 24/7 emergency service, insurance assistance. Free inspections. Call (806) 622-6041",151,true,""
"https://5starroofingpros.comapp/residential-roofing-dumas/","Residential Roofing Dumas TX | 5 Star Roofing",45,"Professional residential roofing in Dumas TX. Expert installation, 24/7 emergency service, insurance assistance. Free inspections. Call (806) 622-6041",150,true,""
"https://5starroofingpros.comapp/residential-roofing-in-amarillo/","Residential Roofing Amarillo TX| 25+ Years Experience",53,"Residential Roofing in Amarillo, TX. Free inspections, insurance claim help, fast response. Call 5 Star Roofing for a free quote today!",135,true,""
"https://5starroofingpros.comapp/residential-roofing-levelland/","Residential Roofing Levelland TX | 5 Star Roofing",49,"Professional residential roofing in Levelland TX. Expert installation, 24/7 emergency service, insurance assistance. Free inspections. Call (806) 622-6041",154,true,""
"https://5starroofingpros.comapp/residential-roofing-lubbock/","Residential Roofing Lubbock TX | 5 Star Roofing",47,"Expert residential roofing in Lubbock TX. Specializing in hail damage claims and Class 4 impact-resistant shingles. Free inspections. Call (806) 622-6041",153,true,""
"https://5starroofingpros.comapp/residential-roofing-lubbock-texas/","Residential Roofing in Lubbock TX| Hail Damage Specialists",58,"Residential Roofing in Lubbock, TX. Free inspections, insurance claim help, fast response. Call 5 Star Roofing for a free quote today!",134,true,""
"https://5starroofingpros.comapp/residential-roofing-midland/","Residential Roofing Midland TX | 5 Star Roofing",47,"Expert residential roofing in Midland TX. Specializing in hail damage claims and Class 4 impact-resistant shingles. Free inspections. Call (806) 622-6041",153,true,""
"https://5starroofingpros.comapp/residential-roofing-midland-texas/","Residential Roofing in Midland TX| Hail Damage Specialists",58,"Residential Roofing in Midland, TX. Free inspections, insurance claim help, fast response. Call 5 Star Roofing for a free quote today!",134,true,""
"https://5starroofingpros.comapp/residential-roofing-monahans/","Residential Roofing Monahans TX | 5 Star Roofing",48,"Professional residential roofing in Monahans TX. Expert installation, 24/7 emergency service, insurance assistance. Free inspections. Call (806) 622-6041",153,true,""
"https://5starroofingpros.comapp/residential-roofing-odessa/","Residential Roofing Odessa TX | 5 Star Roofing",46,"Expert residential roofing in Odessa TX. Specializing in hail damage claims and Class 4 impact-resistant shingles. Free inspections. Call (806) 622-6041",152,true,""
"https://5starroofingpros.comapp/residential-roofing-odessa-texas/","Residential Roofing in Odessa TX| Hail Damage Specialists",57,"Residential Roofing in Odessa, TX. Free inspections, insurance claim help, fast response. Call 5 Star Roofing for a free quote today!",133,true,""
"https://5starroofingpros.comapp/residential-roofing-pampa/","Residential Roofing Pampa TX | 5 Star Roofing",45,"Professional residential roofing in Pampa TX. Expert installation, 24/7 emergency service, insurance assistance. Free inspections. Call (806) 622-6041",150,true,""
"https://5starroofingpros.comapp/residential-roofing-perryton/","Residential Roofing Perryton TX | 5 Star Roofing",48,"Professional residential roofing in Perryton TX. Expert installation, 24/7 emergency service, insurance assistance. Free inspections. Call (806) 622-6041",153,true,""
"https://5starroofingpros.comapp/residential-roofing-snyder/","Residential Roofing Snyder TX | 5 Star Roofing",46,"Professional residential roofing in Snyder TX. Expert installation, 24/7 emergency service, insurance assistance. Free inspections. Call (806) 622-6041",151,true,""
"https://5starroofingpros.comapp/reviews/","Customer Reviews | 5 Star Commercial Roofing Amarillo, Mi...",60,"Read reviews from satisfied customers across West Texas. Call for a free quote!",79,true,"SHORT_META"
"https://5starroofingpros.comapp/roof-hail-damage-repair-services-in-amarillo-tx/","Hail Damage Roof Repair in Amarillo | 5 Star",44,"Hail Damage Repair in Amarillo, TX. Free inspections, insurance claim help, fast response. Call 5 Star Roofing for a free quote today!",134,true,""
"https://5starroofingpros.comapp/roof-heavy-rain-damage-in-amarillo/","Rain Damage Roof Repair Amarillo TX | 5 Star",44,"Expert heavy rain roof damage repair in Amarillo. Flash flood damage, water intrusion, leak detection. Emergency service. Insurance claims. (806) 622-6041",154,true,""
"https://5starroofingpros.comapp/roof-inspection-amarillo-texas/","Roof Inspection in Amarillo, TX| Hail Damage Assessment",55,"Roof Inspections in Amarillo, TX. Free inspections, insurance claim help, fast response. Call 5 Star Roofing for a free quote today!",132,true,""
"https://5starroofingpros.comapp/roof-inspections-amarillo/","Roof Inspections Amarillo TX | 5 Star Roofing",45,"Professional roof inspections in Amarillo TX. Expert installation, 24/7 emergency service, insurance assistance. Free inspections. Call (806) 622-6041",150,true,""
"https://5starroofingpros.comapp/roof-inspections-andrews/","Roof Inspections Andrews TX | 5 Star Commercial Roofing",55,"Professional roof inspections in Andrews TX. Permian Basin experiences 6-8 hailstorms annually. Free inspections. Call (806) 622-6041",133,true,""
"https://5starroofingpros.comapp/roof-inspections-big-spring/","Roof Inspections Big Spring TX | 5 Star Commercial Roofing",58,"Professional roof inspections in Big Spring TX. West Texas experiences 7-9 hailstorms annually. Free inspections. Call (806) 622-6041",133,true,""
"https://5starroofingpros.comapp/roof-inspections-borger/","Roof Inspections Borger TX | 5 Star Roofing",43,"Expert roof inspections in Borger TX. Texas Panhandle experiences 6-8 hailstorms annually. High Plains winds 60+ mph. Free inspections. Call (806) 622-6041",155,true,""
"https://5starroofingpros.comapp/roof-inspections-canyon/","Roof Inspections Canyon TX | 5 Star Roofing",43,"Expert roof inspections in Canyon TX. Texas Panhandle experiences 6-8 hailstorms annually. High Plains winds 60+ mph. Free inspections. Call (806) 622-6041",155,true,""
"https://5starroofingpros.comapp/roof-inspections-dumas/","Roof Inspections Dumas TX | 5 Star Roofing",42,"Expert roof inspections in Dumas TX. Texas Panhandle experiences 6-8 hailstorms annually. High Plains winds 60+ mph. Free inspections. Call (806) 622-6041",154,true,""
"https://5starroofingpros.comapp/roof-inspections-in-amarillo/","Roof Inspections Amarillo TX | 5 Star Roofing",45,"Roof Inspections in Amarillo, TX. Free inspections, insurance claim help, fast response. Call 5 Star Roofing for a free quote today!",132,true,""
"https://5starroofingpros.comapp/roof-inspections-levelland/","Roof Inspections Levelland TX | 5 Star Commercial Roofing",57,"Professional roof inspections in Levelland TX. South Plains experiences 7-10 hailstorms annually. Free inspections. Call (806) 622-6041",135,true,""
"https://5starroofingpros.comapp/roof-inspections-lubbock/","Roof Inspections Lubbock TX | 5 Star Roofing",44,"Professional roof inspections in Lubbock TX. Expert installation, 24/7 emergency service, insurance assistance. Free inspections. Call (806) 622-6041",149,true,""
"https://5starroofingpros.comapp/roof-inspections-midland/","Roof Inspections Midland TX | 5 Star Roofing",44,"Professional roof inspections in Midland TX. Expert installation, 24/7 emergency service, insurance assistance. Free inspections. Call (806) 622-6041",149,true,""
"https://5starroofingpros.comapp/roof-inspections-monahans/","Roof Inspections Monahans TX | 5 Star Commercial Roofing",56,"Professional roof inspections in Monahans TX. Permian Basin experiences 6-8 hailstorms annually. Free inspections. Call (806) 622-6041",134,true,""
"https://5starroofingpros.comapp/roof-inspections-odessa/","Roof Inspections Odessa TX | 5 Star Roofing",43,"Professional roof inspections in Odessa TX. Expert installation, 24/7 emergency service, insurance assistance. Free inspections. Call (806) 622-6041",148,true,""
"https://5starroofingpros.comapp/roof-inspections-pampa/","Roof Inspections Pampa TX | 5 Star Roofing",42,"Expert roof inspections in Pampa TX. Texas Panhandle experiences 6-8 hailstorms annually. High Plains winds 60+ mph. Free inspections. Call (806) 622-6041",154,true,""
"https://5starroofingpros.comapp/roof-inspections-perryton/","Roof Inspections Perryton TX | 5 Star Roofing",45,"Expert roof inspections in Perryton TX. Texas Panhandle experiences 6-8 hailstorms annually. High Plains winds 60+ mph. Free inspections. Call (806) 622-6041",157,true,""
"https://5starroofingpros.comapp/roof-inspections-snyder/","Roof Inspections Snyder TX | 5 Star Commercial Roofing",54,"Professional roof inspections in Snyder TX. West Texas experiences 7-9 hailstorms annually. Free inspections. Call (806) 622-6041",129,true,""
"https://5starroofingpros.comapp/roof-repair-amarillo/","Roof Repair Amarillo TX | Expert Service | Free Inspection",58,"Professional roof repair in Amarillo TX. Expert installation, 24/7 emergency service, insurance assistance. Free inspections. Call (806) 622-6041",145,true,""
"https://5starroofingpros.comapp/roof-repair-andrews/","Roof Repair Andrews TX | 5 Star Commercial Roofing",50,"Professional roof repair services in Andrews TX. Permian Basin experiences 6-8 hailstorms annually. Free inspections. Call (806) 622-6041",137,true,""
"https://5starroofingpros.comapp/roof-repair-big-spring/","Roof Repair Big Spring TX | 5 Star Commercial Roofing",53,"Professional roof repair services in Big Spring TX. West Texas experiences 7-9 hailstorms annually. Free inspections. Call (806) 622-6041",137,true,""
"https://5starroofingpros.comapp/roof-repair-borger/","Roof Repair Borger TX | Same-Day Service | Free Inspection",58,"Expert roof repair in Borger TX. Texas Panhandle experiences 6-8 hailstorms annually. High Plains winds 60+ mph. Free inspections. Call (806) 622-6041",150,true,""
"https://5starroofingpros.comapp/roof-repair-canyon/","Roof Repair Canyon TX | Same-Day Service | Free Inspection",58,"Expert roof repair in Canyon TX. Texas Panhandle experiences 6-8 hailstorms annually. High Plains winds 60+ mph. Free inspections. Call (806) 622-6041",150,true,""
"https://5starroofingpros.comapp/roof-repair-dumas/","Roof Repair Dumas TX | Same-Day Service | Free Inspection",57,"Expert roof repair in Dumas TX. Texas Panhandle experiences 6-8 hailstorms annually. High Plains winds 60+ mph. Free inspections. Call (806) 622-6041",149,true,""
"https://5starroofingpros.comapp/roof-repair-levelland/","Roof Repair Levelland TX | 5 Star Commercial Roofing",52,"Professional roof repair services in Levelland TX. South Plains experiences 7-10 hailstorms annually. Free inspections. Call (806) 622-6041",139,true,""
"https://5starroofingpros.comapp/roof-repair-lubbock/","Roof Repair Lubbock TX | Expert Service | Free Inspection",57,"Professional roof repair in Lubbock TX. Expert installation, 24/7 emergency service, insurance assistance. Free inspections. Call (806) 622-6041",144,true,""
"https://5starroofingpros.comapp/roof-repair-midland/","Roof Repair Midland TX | Expert Service | Free Inspection",57,"Professional roof repair in Midland TX. Expert installation, 24/7 emergency service, insurance assistance. Free inspections. Call (806) 622-6041",144,true,""
"https://5starroofingpros.comapp/roof-repair-monahans/","Roof Repair Monahans TX | 5 Star Commercial Roofing",51,"Professional roof repair services in Monahans TX. Permian Basin experiences 6-8 hailstorms annually. Free inspections. Call (806) 622-6041",138,true,""
"https://5starroofingpros.comapp/roof-repair-odessa/","Roof Repair Odessa TX | Expert Service | Free Inspection",56,"Professional roof repair in Odessa TX. Expert installation, 24/7 emergency service, insurance assistance. Free inspections. Call (806) 622-6041",143,true,""
"https://5starroofingpros.comapp/roof-repair-pampa/","Roof Repair Pampa TX | Same-Day Service | Free Inspection",57,"Expert roof repair in Pampa TX. Texas Panhandle experiences 6-8 hailstorms annually. High Plains winds 60+ mph. Free inspections. Call (806) 622-6041",149,true,""
"https://5starroofingpros.comapp/roof-repair-perryton/","Roof Repair Perryton TX | Same-Day Service | Free Inspection",60,"Expert roof repair in Perryton TX. Texas Panhandle experiences 6-8 hailstorms annually. High Plains winds 60+ mph. Free inspections. Call (806) 622-6041",152,true,""
"https://5starroofingpros.comapp/roof-repair-services-in-amarillo/","Roof Repair Services in Amarillo TXService | 5 Star",51,"Roof Repair in Amarillo, TX. Free inspections, insurance claim help, fast response. Call 5 Star Roofing for a free quote today!",127,true,""
"https://5starroofingpros.comapp/roof-repair-snyder/","Roof Repair Snyder TX | 5 Star Commercial Roofing",49,"Professional roof repair services in Snyder TX. West Texas experiences 7-9 hailstorms annually. Free inspections. Call (806) 622-6041",133,true,""
"https://5starroofingpros.comapp/roof-replacement-amarillo/","Roof Replacement Amarillo TX | 5 Star Roofing",45,"Roof Replacement in Amarillo, TX. Free inspections, insurance claim help, fast response. Call 5 Star Roofing for a free quote today!",132,true,""
"https://5starroofingpros.comapp/roof-replacement-andrews/","Roof Replacement Andrews TX | 5 Star Roofing",44,"Professional roof replacement in Andrews TX. Expert installation, 24/7 emergency service, insurance assistance. Free inspections. Call (806) 622-6041",149,true,""
"https://5starroofingpros.comapp/roof-replacement-big-spring/","Roof Replacement Big Spring TX | 5 Star Roofing",47,"Professional roof replacement in Big Spring TX. Expert installation, 24/7 emergency service, insurance assistance. Free inspections. Call (806) 622-6041",152,true,""
"https://5starroofingpros.comapp/roof-replacement-borger/","Roof Replacement Borger TX | 5 Star Roofing",43,"Professional roof replacement in Borger TX. Expert installation, 24/7 emergency service, insurance assistance. Free inspections. Call (806) 622-6041",148,true,""
"https://5starroofingpros.comapp/roof-replacement-canyon/","Roof Replacement Canyon TX | 5 Star Roofing",43,"Professional roof replacement in Canyon TX. Expert installation, 24/7 emergency service, insurance assistance. Free inspections. Call (806) 622-6041",148,true,""
"https://5starroofingpros.comapp/roof-replacement-dumas/","Roof Replacement Dumas TX | Expert Service | Free Inspection",60,"Professional roof replacement in Dumas TX. Expert installation, 24/7 emergency service, insurance assistance. Free inspections. Call (806) 622-6041",147,true,""
"https://5starroofingpros.comapp/roof-replacement-in-amarillo/","Roof Replacement Amarillo TXAssistance | 5 Star",47,"Roof Replacement in Amarillo, TX. Free inspections, insurance claim help, fast response. Call 5 Star Roofing for a free quote today!",132,true,""
